{
    "$schema": "../move.schema.json",
    "type": "TYPE_FLYING",
    "quality": "MOVE_QUALITY_DAMAGE",
    "category": "MOVE_CATEGORY_SPECIAL",
    "power": 75,
    "accuracy": 95,
    "pp": 20,
    "priority": 0,
    "hits": {
        "min": 0,
        "max": 0
    },
    "inflicts": {
        "condition": "CONDITION_NONE",
        "chance": 0,
        "duration": 0,
        "min_turns": 0,
        "max_turns": 0
    },
    "crit_stage": 0,
    "flinch_chance": 30,
    "effect": "BATTLE_EFFECT_FLINCH_HIT",
    "drain": 0,
    "heal": 0,
    "target": "MOVE_TARGET_SELECTED",
    "stat_changes": [],
    "flags": [ "MOVE_FLAG_PROTECT", "MOVE_FLAG_MIRROR_MOVE", "MOVE_FLAG_DISTANT" ]
}
