{
    "$schema": "../move.schema.json",
    "type": "TYPE_ELECTRIC",
    "quality": "MOVE_QUALITY_DAMAGE_LOWER_TARGET_STATS",
    "category": "MOVE_CATEGORY_SPECIAL",
    "power": 55,
    "accuracy": 95,
    "pp": 15,
    "priority": 0,
    "hits": {
        "min": 0,
        "max": 0
    },
    "inflicts": {
        "condition": "CONDITION_NONE",
        "chance": 0,
        "duration": 0,
        "min_turns": 0,
        "max_turns": 0
    },
    "crit_stage": 0,
    "flinch_chance": 0,
    "effect": "BATTLE_EFFECT_SPEED_DOWN",
    "drain": 0,
    "heal": 0,
    "target": "MOVE_TARGET_ADJACENT_FOES",
    "stat_changes": [
        {
            "stat": "BATTLEMON_SPEED_STAGE",
            "stages": -1,
            "chance": 100
        }
    ],
    "flags": [ "MOVE_FLAG_PROTECT", "MOVE_FLAG_MIRROR_MOVE" ]
}
