{
    "$schema": "../move.schema.json",
    "type": "TYPE_NORMAL",
    "quality": "MOVE_QUALITY_DAMAGE",
    "category": "MOVE_CATEGORY_PHYSICAL",
    "power": 1,
    "accuracy": 100,
    "pp": 15,
    "priority": 0,
    "hits": {
        "min": 0,
        "max": 0
    },
    "inflicts": {
        "condition": "CONDITION_NONE",
        "chance": 0,
        "duration": 0,
        "min_turns": 0,
        "max_turns": 0
    },
    "crit_stage": 0,
    "flinch_chance": 0,
    "effect": "BATTLE_EFFECT_NATURAL_GIFT",
    "drain": 0,
    "heal": 0,
    "target": "MOVE_TARGET_SELECTED",
    "stat_changes": [],
    "flags": [ "MOVE_FLAG_PROTECT", "MOVE_FLAG_MIRROR_MOVE" ]
}
